{
  "schema_version": 1,
  "control_id": "SIM000099",
  "message_type": "ADT",
  "trigger_event": "A03",
  "sending_facility": "WARDWATCH_ICU",
  "mrn": "MRN0001234",
  "message_time": "2024-03-17T09:15:00+00:00",
  "received_at": "2024-03-17T09:15:00.500000Z",
  "segments": [
    {
      "id": "MSH",
      "fields": [
        [
          [
            [
              "|"
            ]
          ]
        ],
        [
          [
            [
              "^~\\&"
            ]
          ]
        ],
        [
          [
            [
              "WWSIM"
            ]
          ]
        ],
        [
          [
            [
              "WARDWATCH_ICU"
            ]
          ]
        ],
        [
          [
            [
              "WARDWATCH"
            ]
          ]
        ],
        [
          [
            [
              "WARDWATCH"
            ]
          ]
        ],
        [
          [
            [
              "20240317091500+0000"
            ]
          ]
        ],
        [],
        [
          [
            [
              "ADT"
            ],
            [
              "A03"
            ],
            [
              "ADT_A03"
            ]
          ]
        ],
        [
          [
            [
              "SIM000099"
            ]
          ]
        ],
        [
          [
            [
              "P"
            ]
          ]
        ],
        [
          [
            [
              "2.5.1"
            ]
          ]
        ]
      ]
    },
    {
      "id": "EVN",
      "fields": [
        [
          [
            [
              "A03"
            ]
          ]
        ],
        [
          [
            [
              "20240317091500+0000"
            ]
          ]
        ]
      ]
    },
    {
      "id": "PID",
      "fields": [
        [
          [
            [
              "1"
            ]
          ]
        ],
        [],
        [
          [
            [
              "MRN0001234"
            ],
            [
              ""
            ],
            [
              ""
            ],
            [
              "WARDWATCH"
            ],
            [
              "MR"
            ]
          ]
        ],
        [],
        [
          [
            [
              "Lindgren"
            ],
            [
              "Ada"
            ],
            [
              "M"
            ]
          ]
        ],
        [],
        [
          [
            [
              "19580214"
            ]
          ]
        ],
        [
          [
            [
              "F"
            ]
          ]
        ],
        [],
        [],
        [
          [
            [
              "12 Harbor Rd"
            ],
            [
              ""
            ],
            [
              "Boston"
            ],
            [
              "MA"
            ],
            [
              "02110"
            ],
            [
              "USA"
            ]
          ]
        ]
      ]
    },
    {
      "id": "PV1",
      "fields": [
        [
          [
            [
              "1"
            ]
          ]
        ],
        [
          [
            [
              "I"
            ]
          ]
        ],
        [
          [
            [
              "ICU"
            ],
            [
              "01"
            ],
            [
              "A"
            ],
            [
              "WARDWATCH"
            ]
          ]
        ],
        [],
        [],
        [],
        [],
        [],
        [],
        [],
        [],
        [],
        [],
        [],
        [],
        [],
        [],
        [],
        [
          [
            [
              "ENC000001"
            ],
            [
              ""
            ],
            [
              ""
            ],
            [
              "WARDWATCH"
            ],
            [
              "VN"
            ]
          ]
        ],
        [],
        [],
        [],
        [],
        [],
        [],
        [],
        [],
        [],
        [],
        [],
        [],
        [],
        [],
        [],
        [],
        [],
        [],
        [],
        [],
        [],
        [],
        [],
        [],
        [
          [
            [
              "20240315083000+0000"
            ]
          ]
        ],
        [
          [
            [
              "20240317091500+0000"
            ]
          ]
        ]
      ]
    }
  ],
  "warnings": [
    {
      "code": "SEGMENT_TERMINATOR_NOT_CR",
      "detail": "segments end with LF",
      "location": "MSH[1]"
    }
  ],
  "raw_base64": "TVNIfF5+XCZ8V1dTSU18V0FSRFdBVENIX0lDVXxXQVJEV0FUQ0h8V0FSRFdBVENIfDIwMjQwMzE3MDkxNTAwKzAwMDB8fEFEVF5BMDNeQURUX0EwM3xTSU0wMDAwOTl8UHwyLjUuMQpFVk58QTAzfDIwMjQwMzE3MDkxNTAwKzAwMDAKUElEfDF8fE1STjAwMDEyMzReXl5XQVJEV0FUQ0heTVJ8fExpbmRncmVuXkFkYV5NfHwxOTU4MDIxNHxGfHx8MTIgSGFyYm9yIFJkXl5Cb3N0b25eTUFeMDIxMTBeVVNBClBWMXwxfEl8SUNVXjAxXkFeV0FSRFdBVENIfHx8fHx8fHx8fHx8fHx8fEVOQzAwMDAwMV5eXldBUkRXQVRDSF5WTnx8fHx8fHx8fHx8fHx8fHx8fHx8fHx8fHwyMDI0MDMxNTA4MzAwMCswMDAwfDIwMjQwMzE3MDkxNTAwKzAwMDAK"
}
